{
  "$schema": "https://json-schema.org/draft/2020-12/schema",
  "$id": "vv5_ui_native_stabilization_gate.schema.json",
  "title": "Disabled VV5 UI native-evidence stabilization gate",
  "type": "object",
  "additionalProperties": false,
  "required": ["id", "game_id", "enabled", "catalog_hidden", "catalog_enabled", "publication_ready", "native_output", "status", "actions", "stock", "resource_caption", "detail_evidence", "c260_rejection", "transaction_contract", "fullscreen_owner", "full_heal", "composition"],
  "properties": {
    "id": {"const": "vv5_ui_native_stabilization_gate"},
    "game_id": {"const": "vv5"},
    "enabled": {"const": false},
    "catalog_hidden": {"const": true},
    "catalog_enabled": {"const": false},
    "publication_ready": {"const": false},
    "native_output": {"const": false},
    "status": {"const": "disabled; additive evidence gate only"},
    "actions": {"const": ["youth", "full_mastery", "running", "age_18"]},
    "stock": {"const": {"filename": "Virtual Villagers - New Believers.exe", "size": 991232, "sha256": "92946781980220E9D1A2E6C573925519934608F5215F4A0F8CE3B90088C5C65D"}},
    "resource_caption": {"$ref": "#/$defs/resource_caption"},
    "detail_evidence": {"$ref": "#/$defs/detail_evidence"},
    "c260_rejection": {"$ref": "#/$defs/c260_rejection"},
    "transaction_contract": {"$ref": "#/$defs/transaction_contract"},
    "fullscreen_owner": {"$ref": "#/$defs/fullscreen_owner"},
    "full_heal": {"$ref": "#/$defs/full_heal"},
    "composition": {"$ref": "#/$defs/composition"}
  },
  "$defs": {
    "resource_caption": {"type": "object", "additionalProperties": false, "required": ["asset", "resource_id", "dimensions", "local", "tech", "detail", "caption_text", "caption_verified", "caption_status"], "properties": {"asset": {"const": "Images\\btn_trophies.png"}, "resource_id": {"const": "0x6A"}, "dimensions": {"const": [96, 39]}, "local": {"const": [137, 2]}, "tech": {"const": {"event": 13, "factory_va": "0x401BD0", "ownership_va": "0x40C680"}}, "detail": {"const": {"event": 13, "factory_va": "0x401BD0", "ownership_va": "0x40C680"}}, "caption_text": {"type": ["string", "null"]}, "caption_verified": {"const": false}, "caption_status": {"const": "pending authenticated caption evidence"}}},
    "detail_evidence": {"type": "object", "additionalProperties": false, "required": ["input_method_entry_va", "input_method_entry_bytes", "input_method_semantics", "input_event13_route", "event_method_range", "event_method_size", "event_method_sha256", "event_method_entry_bytes", "event_method_cleanup", "event_vtable_slot_va", "dispatcher_range", "dispatcher_size", "dispatcher_sha256", "dispatcher_call_range", "ownership", "offline_detour", "stock_xref_to_7B22C0", "stock_xref_to_7B2600", "status"], "properties": {"input_method_entry_va": {"const": "0x44B560"}, "input_method_entry_bytes": {"const": "83EC44535556BD7F03000057BF580300"}, "input_method_semantics": {"const": "Detail input/hit-test method entry; not an event-13 route"}, "input_event13_route": {"const": false}, "event_method_range": {"const": "[0x44BC20,0x44BD4C)"}, "event_method_size": {"const": 300}, "event_method_sha256": {"const": "DE25D2B76DC7E6337F40F06CBF25FCDCEC411BD9D7F1E7DC78406C157501DC74"}, "event_method_entry_bytes": {"const": "83EC18A1A8974D00"}, "event_method_cleanup": {"const": "ret 8"}, "event_vtable_slot_va": {"const": "0x49A5A0"}, "dispatcher_range": {"const": "[0x4019B8,0x4019CF)"}, "dispatcher_size": {"const": 23}, "dispatcher_sha256": {"const": "F2EB107944977E8CBCE7CAD450EC6D1D046880727EBDE36A939CF5DC5DDC907F"}, "dispatcher_call_range": {"const": "[0x4019CD,0x4019CF)"}, "ownership": {"$ref": "#/$defs/ownership"}, "offline_detour": {"$ref": "#/$defs/offline_detour"}, "stock_xref_to_7B22C0": {"const": false}, "stock_xref_to_7B2600": {"const": false}, "status": {"const": "mechanical offline evidence only; runtime and player receipt STOP"}}},
    "ownership": {"type": "object", "additionalProperties": false, "required": ["factory_va", "registration_va", "inner_id_offset", "inner_parent_offset", "dispatcher_vtable_offset", "constructor_control_id", "teardown_chain"], "properties": {"factory_va": {"const": "0x401BD0"}, "registration_va": {"const": "0x40C680"}, "inner_id_offset": {"const": "+0x4"}, "inner_parent_offset": {"const": "+0x20"}, "dispatcher_vtable_offset": {"const": "+0x0C"}, "constructor_control_id": {"const": 13}, "teardown_chain": {"const": ["0x44B9F0", "0x44AF30", "0x40C7F0", "0x40C830"]}}},
    "offline_detour": {"type": "object", "additionalProperties": false, "required": ["raw_offset", "preimage", "detour", "target_va", "continuation_va", "guard", "fallback_replay", "install_verified", "uninstall_verified", "hot_uninstall_verified"], "properties": {"raw_offset": {"const": "0x4BC20"}, "preimage": {"const": "83EC18A1A8974D00"}, "detour": {"const": "E99B643600909090"}, "target_va": {"const": "0x7B20C0"}, "continuation_va": {"const": "0x44BC28"}, "guard": {"const": {"message": 8, "control_id": 13}}, "fallback_replay": {"const": "83EC18A1A8974D00"}, "install_verified": {"const": true}, "uninstall_verified": {"const": true}, "hot_uninstall_verified": {"const": false}}},
    "c260_rejection": {"type": "object", "additionalProperties": false, "required": ["bad_pointer_va", "authenticated_string_va", "requested_symbol", "repair_status", "repair_output", "menu_reached", "runtime_verified"], "properties": {"bad_pointer_va": {"const": "0x7B2A64"}, "authenticated_string_va": {"const": "0x7B2A63"}, "requested_symbol": {"const": "DL_GetWindowFlags"}, "repair_status": {"const": "rejected; static-only evidence"}, "repair_output": {"const": []}, "menu_reached": {"const": false}, "runtime_verified": {"const": false}}},
    "transaction_contract": {"type": "object", "additionalProperties": false, "required": ["sequence", "confirmation_results", "identity_fields", "exact_identity_required_at", "full_record_snapshot_required", "before_reacquire_required", "before_funds_reacquire_required", "world_identity_rule", "selection_callback", "account_balance_callback", "deduction_callback", "callback_exception_policy", "fail_closed_stages", "funds_snapshot_exact_required", "one_deduction_only", "deduction_after_final_postverify", "charge_truth", "unknown_charge_text", "rollback_policy", "reference_model", "running_existing_like_cleanup"], "properties": {"sequence": {"type": "array", "items": {"type": "string"}}, "confirmation_results": {"const": {"idok": 1, "cancel": [0, 2]}}, "identity_fields": {"const": ["selected_index", "world_identity", "record_pointer", "account_identity"]}, "exact_identity_required_at": {"const": ["plan", "reacquire", "first_write", "like_postverify", "dislike_write", "final_postverify", "deduction", "rollback_restore"]}, "full_record_snapshot_required": {"const": true}, "before_reacquire_required": {"const": true}, "before_funds_reacquire_required": {"const": true}, "world_identity_rule": {"const": "exact non-bool positive world_identity; bool, zero, negative, and float values reject"}, "selection_callback": {"const": {"returns": ["world_identity", "record", "selected_index", "resolved_pointer"], "shape": "(world, record, selected_index, resolved_pointer)"}}, "account_balance_callback": {"const": {"returns": ["world_identity", "account_identity", "balance"], "shape": "(world, account, balance)"}}, "deduction_callback": {"const": {"arguments": ["world_identity", "account_identity", "amount"], "shape": "(world, account, amount)"}}, "callback_exception_policy": {"const": "callback exception or world/selection/account mismatch fails closed before first write and at every later guarded stage"}, "fail_closed_stages": {"const": ["first_write", "like_postverify", "full_postverify", "pre_deduction", "charge_readback", "rollback_restore"]}, "funds_snapshot_exact_required": {"const": true}, "one_deduction_only": {"const": true}, "deduction_after_final_postverify": {"const": true}, "charge_truth": {"const": "truthful only from exact balance-before/after readback; otherwise unknown"}, "unknown_charge_text": {"type": "string", "minLength": 1}, "rollback_policy": {"$ref": "#/$defs/rollback_policy"}, "reference_model": {"$ref": "#/$defs/reference_model"}, "running_existing_like_cleanup": {"$ref": "#/$defs/running_cleanup"}}},
    "rollback_policy": {"type": "object", "additionalProperties": false, "required": ["native_rollback_verified", "partial_effect_disclosure_required", "no_charge_claim_requires_exact_balance_readback", "status"], "properties": {"native_rollback_verified": {"const": false}, "partial_effect_disclosure_required": {"const": true}, "no_charge_claim_requires_exact_balance_readback": {"const": true}, "status": {"const": "reference-only; native writes, readback, and rollback are not implemented"}}},
    "reference_model": {"type": "object", "additionalProperties": false, "required": ["path", "selected_index_and_record_pointer_reacquire", "full_snapshot_reacquire", "account_identity_token", "later_stage_identity_verified", "native_write", "native_readback", "native_rollback", "status"], "properties": {"path": {"const": "src/vv5_individual_transactions.py"}, "selected_index_and_record_pointer_reacquire": {"const": true}, "full_snapshot_reacquire": {"const": true}, "account_identity_token": {"type": "null"}, "later_stage_identity_verified": {"const": false}, "native_write": {"const": false}, "native_readback": {"const": false}, "native_rollback": {"const": false}, "status": {"const": "reference arithmetic only; no native effect is claimed"}}},
    "running_cleanup": {"type": "object", "additionalProperties": false, "required": ["current_reference_model", "binding_required_before_native_charge", "native_charge_allowed", "status"], "properties": {"current_reference_model": {"const": "changed_and_charged"}, "binding_required_before_native_charge": {"const": true}, "native_charge_allowed": {"const": false}, "status": {"const": "pending explicit Running binding for Like/Dislike cleanup semantics"}}},
    "fullscreen_owner": {"type": "object", "additionalProperties": false, "required": ["owner_abi", "capture_before_leave", "same_process_revalidation", "no_foreground_fallback", "single_terminal_cleanup", "cleanup_scope", "owner_output", "player_receipts", "status"], "properties": {"owner_abi": {"const": {"begin": "zero-arg stdcall BeginOriginsOwner", "get": "zero-arg stdcall GetOriginsOwner", "end": "zero-arg stdcall EndOriginsOwner"}}, "capture_before_leave": {"const": true}, "same_process_revalidation": {"const": true}, "no_foreground_fallback": {"const": true}, "single_terminal_cleanup": {"const": true}, "cleanup_scope": {"const": "one centralized wrapper epilogue after every post-Begin route"}, "owner_output": {"const": []}, "player_receipts": {"$ref": "#/$defs/receipts"}, "status": {"const": "pending authenticated owner and player evidence"}}},
    "receipts": {"type": "object", "additionalProperties": false, "required": ["tech_windowed", "tech_fullscreen", "detail_windowed", "detail_fullscreen"], "properties": {"tech_windowed": {"type": "null"}, "tech_fullscreen": {"type": "null"}, "detail_windowed": {"type": "null"}, "detail_fullscreen": {"type": "null"}}},
    "full_heal": {"type": "object", "additionalProperties": false, "required": ["path", "enabled", "catalog_hidden", "catalog_enabled", "publication_ready", "native_output", "hooks", "caves", "patches", "ranges", "native_abi_evidence_complete"], "properties": {"path": {"const": "data/vv5_full_heal_native_abi_evidence.json"}, "enabled": {"const": false}, "catalog_hidden": {"const": true}, "catalog_enabled": {"const": false}, "publication_ready": {"const": false}, "native_output": {"const": false}, "hooks": {"const": []}, "caves": {"const": []}, "patches": {"const": []}, "ranges": {"const": []}, "native_abi_evidence_complete": {"const": false}}},
    "composition": {"type": "object", "additionalProperties": false, "required": ["stock_sha256", "full_mastery_range", "running_range", "ui_ranges", "full_heal_ranges", "hooks", "caves", "patches", "expanded_rejected"], "properties": {"stock_sha256": {"const": "92946781980220E9D1A2E6C573925519934608F5215F4A0F8CE3B90088C5C65D"}, "full_mastery_range": {"const": "0xF2000-0xF4000"}, "running_range": {"const": "0xF4000-0xF6000"}, "ui_ranges": {"const": []}, "full_heal_ranges": {"const": []}, "hooks": {"const": []}, "caves": {"const": []}, "patches": {"const": []}, "expanded_rejected": {"const": true}}}
  }
}
