{
  "id": "vv5_ui_native_stabilization_gate",
  "game_id": "vv5",
  "enabled": false,
  "catalog_hidden": true,
  "catalog_enabled": false,
  "publication_ready": false,
  "native_output": false,
  "status": "disabled; additive evidence gate only",
  "actions": ["youth", "full_mastery", "running", "age_18"],
  "stock": {
    "filename": "Virtual Villagers - New Believers.exe",
    "size": 991232,
    "sha256": "92946781980220E9D1A2E6C573925519934608F5215F4A0F8CE3B90088C5C65D"
  },
  "resource_caption": {
    "asset": "Images\\btn_trophies.png",
    "resource_id": "0x6A",
    "dimensions": [96, 39],
    "local": [137, 2],
    "tech": {"event": 13, "factory_va": "0x401BD0", "ownership_va": "0x40C680"},
    "detail": {"event": 13, "factory_va": "0x401BD0", "ownership_va": "0x40C680"},
    "caption_text": null,
    "caption_verified": false,
    "caption_status": "pending authenticated caption evidence"
  },
  "detail_evidence": {
    "input_method_entry_va": "0x44B560",
    "input_method_entry_bytes": "83EC44535556BD7F03000057BF580300",
    "input_method_semantics": "Detail input/hit-test method entry; not an event-13 route",
    "input_event13_route": false,
    "event_method_range": "[0x44BC20,0x44BD4C)",
    "event_method_size": 300,
    "event_method_sha256": "DE25D2B76DC7E6337F40F06CBF25FCDCEC411BD9D7F1E7DC78406C157501DC74",
    "event_method_entry_bytes": "83EC18A1A8974D00",
    "event_method_cleanup": "ret 8",
    "event_vtable_slot_va": "0x49A5A0",
    "dispatcher_range": "[0x4019B8,0x4019CF)",
    "dispatcher_size": 23,
    "dispatcher_sha256": "F2EB107944977E8CBCE7CAD450EC6D1D046880727EBDE36A939CF5DC5DDC907F",
    "dispatcher_call_range": "[0x4019CD,0x4019CF)",
    "ownership": {
      "factory_va": "0x401BD0",
      "registration_va": "0x40C680",
      "inner_id_offset": "+0x4",
      "inner_parent_offset": "+0x20",
      "dispatcher_vtable_offset": "+0x0C",
      "constructor_control_id": 13,
      "teardown_chain": ["0x44B9F0", "0x44AF30", "0x40C7F0", "0x40C830"]
    },
    "offline_detour": {
      "raw_offset": "0x4BC20",
      "preimage": "83EC18A1A8974D00",
      "detour": "E99B643600909090",
      "target_va": "0x7B20C0",
      "continuation_va": "0x44BC28",
      "guard": {"message": 8, "control_id": 13},
      "fallback_replay": "83EC18A1A8974D00",
      "install_verified": true,
      "uninstall_verified": true,
      "hot_uninstall_verified": false
    },
    "stock_xref_to_7B22C0": false,
    "stock_xref_to_7B2600": false,
    "status": "mechanical offline evidence only; runtime and player receipt STOP"
  },
  "c260_rejection": {
    "bad_pointer_va": "0x7B2A64",
    "authenticated_string_va": "0x7B2A63",
    "requested_symbol": "DL_GetWindowFlags",
    "repair_status": "rejected; static-only evidence",
    "repair_output": [],
    "menu_reached": false,
    "runtime_verified": false
  },
  "transaction_contract": {
    "sequence": [
      "dry_run_snapshot",
      "idok_confirmation",
      "before_reacquire",
      "before_funds_reacquire",
      "first_write_identity_check",
      "like_write_postverify",
      "dislike_write_identity_check",
      "final_postverify",
      "deduction",
      "deduction_readback",
      "rollback_or_disclosure"
    ],
    "confirmation_results": {"idok": 1, "cancel": [0, 2]},
    "identity_fields": ["selected_index", "world_identity", "record_pointer", "account_identity"],
    "exact_identity_required_at": ["plan", "reacquire", "first_write", "like_postverify", "dislike_write", "final_postverify", "deduction", "rollback_restore"],
    "full_record_snapshot_required": true,
    "before_reacquire_required": true,
    "before_funds_reacquire_required": true,
    "world_identity_rule": "exact non-bool positive world_identity; bool, zero, negative, and float values reject",
    "selection_callback": {
      "returns": ["world_identity", "record", "selected_index", "resolved_pointer"],
      "shape": "(world, record, selected_index, resolved_pointer)"
    },
    "account_balance_callback": {
      "returns": ["world_identity", "account_identity", "balance"],
      "shape": "(world, account, balance)"
    },
    "deduction_callback": {
      "arguments": ["world_identity", "account_identity", "amount"],
      "shape": "(world, account, amount)"
    },
    "callback_exception_policy": "callback exception or world/selection/account mismatch fails closed before first write and at every later guarded stage",
    "fail_closed_stages": ["first_write", "like_postverify", "full_postverify", "pre_deduction", "charge_readback", "rollback_restore"],
    "funds_snapshot_exact_required": true,
    "one_deduction_only": true,
    "deduction_after_final_postverify": true,
    "charge_truth": "truthful only from exact balance-before/after readback; otherwise unknown",
    "unknown_charge_text": "The tech-point charge outcome is unknown; no no-charge claim is permitted without exact balance readback.",
    "rollback_policy": {
      "native_rollback_verified": false,
      "partial_effect_disclosure_required": true,
      "no_charge_claim_requires_exact_balance_readback": true,
      "status": "reference-only; native writes, readback, and rollback are not implemented"
    },
    "reference_model": {
      "path": "src/vv5_individual_transactions.py",
      "selected_index_and_record_pointer_reacquire": true,
      "full_snapshot_reacquire": true,
      "account_identity_token": null,
      "later_stage_identity_verified": false,
      "native_write": false,
      "native_readback": false,
      "native_rollback": false,
      "status": "reference arithmetic only; no native effect is claimed"
    },
    "running_existing_like_cleanup": {
      "current_reference_model": "changed_and_charged",
      "binding_required_before_native_charge": true,
      "native_charge_allowed": false,
      "status": "pending explicit Running binding for Like/Dislike cleanup semantics"
    }
  },
  "fullscreen_owner": {
    "owner_abi": {
      "begin": "zero-arg stdcall BeginOriginsOwner",
      "get": "zero-arg stdcall GetOriginsOwner",
      "end": "zero-arg stdcall EndOriginsOwner"
    },
    "capture_before_leave": true,
    "same_process_revalidation": true,
    "no_foreground_fallback": true,
    "single_terminal_cleanup": true,
    "cleanup_scope": "one centralized wrapper epilogue after every post-Begin route",
    "owner_output": [],
    "player_receipts": {
      "tech_windowed": null,
      "tech_fullscreen": null,
      "detail_windowed": null,
      "detail_fullscreen": null
    },
    "status": "pending authenticated owner and player evidence"
  },
  "full_heal": {
    "path": "data/vv5_full_heal_native_abi_evidence.json",
    "enabled": false,
    "catalog_hidden": true,
    "catalog_enabled": false,
    "publication_ready": false,
    "native_output": false,
    "hooks": [],
    "caves": [],
    "patches": [],
    "ranges": [],
    "native_abi_evidence_complete": false
  },
  "composition": {
    "stock_sha256": "92946781980220E9D1A2E6C573925519934608F5215F4A0F8CE3B90088C5C65D",
    "full_mastery_range": "0xF2000-0xF4000",
    "running_range": "0xF4000-0xF6000",
    "ui_ranges": [],
    "full_heal_ranges": [],
    "hooks": [],
    "caves": [],
    "patches": [],
    "expanded_rejected": true
  }
}
